{
  "reasoningId": "reasoning-channel-b-002",
  "state": "stopped",
  "title": "已深度思考",
  "statusLabel": "已停止",
  "statusTone": "Warning",
  "timerText": "已思考 6 秒 · 已停止于第 2 段",
  "traceExpanded": false,
  "traceCollapsed": true,
  "collapsedSummary": "已保留停止前的 2 段推理过程",
  "phases": [
    {
      "thought": "先拆分线索、试用激活与付费三段漏斗，核对近 90 天数据。",
      "actions": [
        { "tool": "query_metrics", "detail": "channel=B · range=90d · group=stage", "statusGlyph": "●", "statusTone": "Good" },
        { "tool": "read_file", "detail": "~/analytics/funnel_definition.sql · ×2", "statusGlyph": "●", "statusTone": "Good" },
        { "tool": "run_sql", "detail": "按漏斗阶段汇总数量与转化率", "statusGlyph": "●", "statusTone": "Good" }
      ]
    },
    {
      "thought": "激活率降幅高于线索量，开始按行业与试用权益触达交叉核验。",
      "actions": [
        { "tool": "query_metrics", "detail": "按行业拆分激活率", "statusGlyph": "●", "statusTone": "Good" },
        { "tool": "search_tickets", "detail": "调用已由用户停止", "statusGlyph": "●", "statusTone": "Accent" }
      ]
    }
  ]
}
